post_id,product_id,parent_id,user_id,material,likes_count,created_at,updated_at,deleted_at
33ANE74QUL5C,F79QO85K8O,NULL,76432053,当社の新薬品は、最新のトレンドを反映した成分を使用しており、業界の課題解決に貢献します。コスト削減を実現しながら、効果的なクロージングをサポートするため、営業チームは自信を持って提案できます。お客様のニーズに応えるこの商品は、競争力を高める最適な選択です。,6,2023-04-20 13:05,NULL,NULL
I7SAD034BKM6,BVVGZYLMT1,NULL,43175792,この薬品は流通の効率性を重視しており、迅速な配送が可能です。高品質な成分を使用しているため、信頼性も抜群。営業活動において、顧客からの信頼を得やすく、リピート率が高まること間違いなしです。,10,2023-04-20 15:30,NULL,NULL
Q4B1J0OVT01T,NU212I8EAW,NULL,59233102,この薬品は、過去の失敗事例をしっかりと分析し、改善された提案書を基に開発されました。コラボレーションによって実現したこの商品は、信頼性と効果を兼ね備えており、営業現場でも自信を持って推奨できる一品です。,6,2023-04-22 01:48,NULL,NULL
U51GHTJK93W1,G033Q1QI0Z,NULL,64993416,この商品は、ITと金融の融合を実現し、効率的な交渉をサポートします。最新のトレンドを反映した機能は競合分析にも優れ、イベントやサプライチェーン管理にも役立ちます。営業活動の強力な武器となるでしょう。,8,2023-04-23 02:32,2024-02-23 14:44,NULL
6KC9CHCVVG45,HU1LUCYO06,NULL,00975148,この商品は、流通の効率化を図ることでコスト削減を実現し、競合分析に基づいた独自の強みを持っています。営業チームにとって、顧客ニーズに応じた提案がしやすく、販売促進に大いに役立つアイテムです。,5,2023-04-23 11:59,NULL,NULL
MC4GDQTGC303,BNJBT7LP9E,ANRWR5PK7PC9,33648077,新商品は流通のトレンドを捉え、競合分析を基にした独自のプレゼンテーションが強みです。イベントでの実演を通じて、顧客の関心を引き、販売促進に繋げることが期待できます。今後の市場展開において、競争力を高める要素が満載です。,0,2023-04-26 18:42,NULL,NULL
EWXNIQ6B45EZ,47VGWN5RKU,NULL,36393300,新商品はコスト削減を実現し、既存商品とのシナジー効果も期待できます。プレゼンテーションを通じて、イノベーションの要素を強調し、リードを獲得するための強力なツールとして活用しましょう。営業の視点で見ると、顧客のニーズに応える最適なソリューションです。,5,2023-04-28 08:17,2024-08-28 10:32,NULL
GWMMMT78HKXC,SGI0Y3UI73,NULL,98876028,当社の製品は、製造業から金融、介護分野まで幅広く適応可能で、プロジェクト管理やフォローアップの効率を大幅に向上させます。サプライチェーンの最適化と品質管理の強化により、顧客満足度を高め、競争力を強化することができます。,7,2023-04-29 04:44,2024-05-27 07:07,NULL
QO109IF7GSYD,OG6QBN656X,NULL,49780674,当社の新製品は、製造業の効率を劇的に向上させる革新的なソリューションです。最近の時事ネタとして、サプライチェーンの混乱を受けて、プロジェクト管理やイベントの迅速な対応が求められています。この商品は、これらの課題を解決するための強力なツールです。,6,2023-05-04 15:08,2023-08-14 19:06,NULL
13CIJLRBP228,5DQIDYTO3T,NULL,04125772,当社の医療マーケティングツールは、顧客ニーズを的確に捉え、効果的なアプローチを実現します。データ分析機能により、ターゲット市場の動向を把握し、競争力を高めるサポートをします。これにより、医療機関の成長を促進する最適なパートナーとなるでしょう。,8,2023-05-05 10:44,NULL,NULL
LAFM03LKY5OV,7GJOXNES7Z,NULL,59233102,当社の新しいITソリューションは、製造業や薬品業界、さらには介護分野における部署間連携を強化し、プロジェクトの効率を飛躍的に向上させます。イベントでのデモを通じて、実際の効果を体感していただける機会をご用意していますので、ぜひご参加ください。,2,2023-05-05 18:16,NULL,NULL
UWBK2PN696FB,EHBMKJF7LM,NULL,18836861,新商品の営業において、フォローアップが鍵となります。リードをしっかり育て、クロージングに向けた教育・トレーニングを行うことで、顧客満足度が向上し、リピート率も高まります。このプロセスを通じて、信頼関係を築くことが成功の秘訣です。,8,2023-05-06 01:37,NULL,NULL
2ZNQ4QOINH6F,CEDDHWC59U,NULL,81926136,新商品は製造業における薬品管理の課題を的確に解決します。効率的な在庫管理と品質保証を実現し、業務のスピードアップを図ることで、コスト削減にも寄与します。ぜひ、この機会に導入をご検討ください。,2,2023-05-09 15:34,2024-03-05 21:37,NULL
ZDYZ6F09TXMG,G4J90885G4,S7YLI2PZZREY,64249803,新商品は、最新のトレンドを取り入れたサービスで、流通の効率化を図りながらコスト削減を実現します。プロジェクト管理においても優れた顧客満足度を誇り、サプライチェーン全体の最適化に寄与します。時事ネタを活用したマーケティング戦略により、さらなる市場拡大が期待できます。,4,2023-05-11 03:04,NULL,NULL
E896JHHZF8RB,5DQIDYTO3T,NULL,73136897,この商品は顧客ニーズにしっかり応え、失敗事例を参考にしながら設計されています。法律・規制に準拠しているため安心して導入でき、生産性向上にも寄与します。営業活動において、これらのポイントを強調することで、顧客の信頼を得やすくなります。,1,2023-05-13 19:18,NULL,NULL
1L72JQW2A8EZ,FUFUUGO1YZ,NULL,50360736,私たちの新しい薬品は、コスト削減を実現しながら、業界最高水準の技術サポートを提供します。効率的な運用をサポートし、顧客のニーズに応えることで、競争力を高めることができます。ぜひ一度お試しください！,4,2023-05-14 10:21,2023-09-11 14:36,NULL
UOQYUQ595INC,G033Q1QI0Z,NULL,64993416,当社の医療商品は、顧客ニーズに基づいた設計が施されており、教育・トレーニングを通じて効果的な使用方法を提供します。また、法律・規制に準拠した安心感があり、リード獲得やマーケティング戦略にも貢献します。顧客対応の質を向上させることで、信頼性の高いパートナーとして選ばれています。,3,2023-05-23 18:03,2024-05-07 19:47,NULL
C50KSJ37VVSV,BN47KP5DYK,NULL,64249803,私たちの介護プロジェクトは、顧客満足度を重視し、イベントを通じて実際のニーズを把握しています。品質管理を徹底し、生産性向上を図ることで、提案書に基づいた最適なソリューションを提供します。これにより、介護現場での効率性とサービス向上を実現します。,1,2023-05-24 15:12,2024-07-03 10:42,NULL
I4YLK0FXR2F2,BNJBT7LP9E,NULL,59233102,当社のITソリューションは、競合分析を通じて市場での優位性を確立し、効果的なマーケティング戦略を支援します。イベントでのデモを通じて、実際の活用シーンを体験できるため、顧客の関心を引きやすく、成約率向上に寄与します。,7,2023-05-27 05:26,2023-12-13 05:14,NULL
TYBU2DSQDFMI,Q0WOPM4JJW,NULL,72415063,当社の医療薬品は、介護現場での使用に最適で、顧客満足度が高い成功事例が多数あります。サプライチェーンも確立されており、迅速な供給が可能です。信頼性のある製品で、安心してご利用いただけます。,3,2023-05-29 18:55,NULL,NULL
EDKIY3A7NF9Z,KJC0OZMC9P,NULL,72415063,この商品は、法律・規制に準拠した設計がされており、安心して使用できます。また、コラボレーション機能が充実しているため、チームでの業務効率が大幅に向上します。プレゼンテーションにも適したビジュアルが魅力で、顧客への提案時に強力な武器となるでしょう。,4,2023-05-30 00:45,NULL,NULL
UZGJZ1U99TS9,JWI5KKZTHH,VGOOVOLXMKZK,01919118,当社の医療用製品は、製造業のニーズに応じた高品質なソリューションを提供します。コスト削減を実現しながら、技術サポートを通じてサプライチェーン全体を最適化。プレゼンテーションを通じて、プロジェクトの成功をサポートします。,4,2023-05-30 08:15,2023-06-02 17:10,NULL
6DWSB5190F78,FUFUUGO1YZ,NULL,33819417,当社の新製品は、製造業における部署間連携を強化するために設計されています。成功事例を基にしたイベントを通じて、実際の効果を体感していただけます。これにより、業務効率が向上し、チーム全体のパフォーマンスが飛躍的に改善されることを実感できるでしょう。,4,2023-06-03 16:24,2024-08-16 14:31,NULL
OBOXQQATG4AZ,BVVGZYLMT1,NULL,68785531,この商品は、医療業界に特化した優れた機能を備えており、競合分析を通じて明確な差別化ポイントが見つかりました。顧客満足度も高く、提案書を活用することで、導入のメリットを効果的に伝えることができます。営業活動において、信頼性と実績を強調することが成功の鍵です。,5,2023-06-04 12:14,NULL,NULL
4GD79IXJTXDZ,95916MF0BS,T73HQYATK7TO,78555463,私たちの新しい金融商品は、流通業界のトレンドを捉えた最適なソリューションです。法律・規制に準拠しつつ、部署間連携を強化することで、課題解決に繋がります。コラボレーションを重視した設計により、顧客満足度を向上させることが可能です。,6,2023-06-06 03:25,NULL,NULL
KN09WZH2RFFF,605S9NIHMN,NULL,92757274,この商品は、ITと医療の融合を実現し、プロジェクト管理を効率化します。競合分析を通じてコスト削減を図り、品質管理の向上にも寄与するため、医療機関にとって必須のツールです。営業の視点から見ても、顧客のニーズに応える強力なソリューションです。,2,2023-06-06 06:28,NULL,NULL
3XOZFUXUALWG,FZE9INV1KK,6UI60JNHDYIQ,34993042,当社の新薬品は、製造業における品質管理の厳格な基準を満たしており、顧客満足度の向上に貢献します。プロジェクトの進行中も、常に高い品質を維持することで、信頼性のある製品を提供し、顧客の期待に応えます。,7,2023-06-07 15:53,NULL,NULL
4050PFA8RAPJ,2809P8I08J,NULL,01919118,当社のIT流通ソリューションは、顧客ニーズに応じた柔軟な提案書を提供し、コスト削減を実現します。イベントを通じて交渉を促進し、競争力のある価格を実現することで、顧客満足度を向上させることができます。,4,2023-06-11 20:31,2023-10-29 15:25,NULL
UI89MBIZFLV2,3UNFQKQ1QS,NULL,29372843,この医療薬品は、競合分析を通じて明確な差別化ポイントを持ち、サプライチェーンの効率性も高いです。交渉時にはその優位性を強調し、クロージングをスムーズに行うためのデータも豊富に揃っています。市場における競争力を考えると、非常に魅力的な製品です。,11,2023-06-15 10:23,2023-10-26 03:24,NULL
J5KT41EGYJH8,OB1GSH8AML,8K73AMFHIVZI,50360736,当社の新しい医療ITソリューションは、競合分析を通じて顧客ニーズに応え、金融業界のトレンドを反映した画期的な機能を搭載しています。フォローアップ機能により、顧客との関係を深め、クロージング率を向上させることが可能です。,4,2023-06-16 07:39,2024-05-31 13:36,NULL
VLLQJ3A44ULC,7RM5SKJIBV,NULL,72415063,当社の新商品は、リード獲得から交渉、成功事例の提示まで、営業プロセス全体をサポートします。マーケティングチームとの連携や技術サポートも充実しており、提案書作成もスムーズに行えます。これにより、商談の成功率が向上し、顧客満足度も高まります。,1,2023-06-17 00:40,2023-07-04 05:26,NULL
UGPFR4D638ML,LZX0JLAH8X,NULL,81926136,この商品は、営業チームの生産性向上に貢献する優れたツールです。教育・トレーニング機能を活用することで、課題解決能力を高め、プロジェクトの進行をスムーズにします。クロージングの成功率も向上し、成果を最大化できる点が魅力です。,2,2023-06-18 01:29,2024-08-20 22:15,NULL
3C3C51RV7NAW,S3U0MJB7KK,FOZMVLO9BBF2,18836861,この商品は、金融業界や介護分野でのプレゼンテーションに特化しており、成功事例を豊富に取り入れています。教育・トレーニングの要素も強化されているため、営業チームが効果的に活用でき、顧客へのアプローチが一層スムーズになります。,0,2023-06-21 18:19,NULL,NULL
PPJXL47LQ3C1,FGDSVCL06J,NULL,53405714,当社の新商品は、最新の技術トレンドを取り入れ、顧客ニーズに応える設計がされています。法規制にも完全に準拠しており、安心してご利用いただけます。また、サプライチェーンの効率化により、迅速な納品が可能です。技術サポートも充実しており、導入後の安心感を提供します。,6,2023-06-22 19:01,NULL,NULL
9SZWWN3YMM91,IDB2QVA5BO,8TNSBNI3XGPJ,59233102,当社の商品は、リードからクロージングまでのプロセスをスムーズに進めるための課題解決に特化しています。顧客満足度を高めるための提案書も充実しており、サプライチェーンの効率化や品質管理にも対応。信頼性の高い商品で、ビジネスの成長をサポートします。,4,2023-06-24 05:14,2023-07-04 02:01,NULL
BMEBDDBSAVHI,BNJBT7LP9E,NULL,64993416,当社の最新商品は、技術サポートが充実しており、導入後の安心感を提供します。イノベーションを追求し、業務効率を大幅に向上させる機能が搭載されており、顧客のニーズに応える最適なソリューションです。ぜひご検討ください。,5,2023-06-27 15:18,NULL,NULL
VE7TKJP4FJYT,7KNT7YGA79,NULL,00975148,私たちの新しい金融商品は、顧客ニーズに応じたコスト削減を実現し、トレンドに敏感な市場での競争力を高めます。フォローアップとコラボレーションを重視した営業戦略で、効果的なクロージングが可能になります。お客様の期待を超える価値を提供し、信頼関係を築くことができます。,7,2023-06-30 02:53,2023-10-13 14:22,NULL
WFBASZZMP722,W2JWLI9PLD,NULL,56361306,当社の最新ITソリューションは、金融業界での成功事例を多数生み出しています。顧客対応の質を向上させ、顧客満足度を高めることで、生産性向上にも寄与します。また、チーム間のコラボレーションを強化し、トレンドに即した迅速な意思決定を実現します。,3,2023-07-02 01:51,2024-07-04 02:56,NULL
Z01AD7AY3BQL,2809P8I08J,NULL,88922696,当社の新商品は、サプライチェーンの効率を最大限に引き出す設計が施されています。フォローアップ機能により、顧客とのコミュニケーションがスムーズになり、信頼関係を築く手助けをします。営業チームにとって、これらの要素は成約率を高める強力な武器です。,5,2023-07-09 09:19,2023-07-30 03:45,NULL
NKQ87JGI6XAW,AFM30TRIXQ,NULL,36393300,新商品は、製造業界において流通の効率化を実現し、競合分析を通じてコスト削減を可能にします。さらに、技術サポートが充実しており、生産性向上に直結するため、導入することで競争力を大幅に強化できます。,1,2023-07-11 11:41,NULL,NULL
TEM903WDWGQH,P0PVKWMFWR,NULL,23248982,私たちの新製品は、最新のイノベーションを取り入れた技術サポートを提供し、顧客の成功事例が続出しています。イベントでのフォローアップを強化することで、リードを効果的に転換し、営業成績を向上させることが可能です。この商品を導入すれば、あなたのビジネスも次のステージへと進化します。,2,2023-07-11 18:19,NULL,NULL
TTEOOKJFKI5O,G033Q1QI0Z,NULL,23248982,この商品は、サプライチェーンの最適化を実現し、生産性向上に直結する革新的なソリューションです。効率的なプロセス管理により、無駄を削減し、迅速な対応が可能になります。この機会にぜひお試しください！,1,2023-07-11 19:14,NULL,NULL
OVD99JCIUH7O,F79QO85K8O,NULL,22527715,この商品は、イベントの運営を効率化し、コスト削減を実現するための最適なソリューションです。使いやすいインターフェースと柔軟なカスタマイズ機能により、営業活動を一層効果的にサポートします。イベントの成功を確実にするために、ぜひご検討ください。,4,2023-07-12 05:43,NULL,NULL
OZ5VDIN54UTV,8MNXS50JH3,NULL,76432053,最新のITトレンドに基づいたこの商品は、営業チームの課題解決に最適です。効率的なデータ分析機能により、顧客ニーズを的確に把握し、提案力を向上させます。競争が激化する市場で、迅速な意思決定をサポートする頼もしいパートナーです。,0,2023-07-13 10:16,NULL,NULL
MHP9PPMCRHMK,NYCKKQ7VEN,NULL,88922696,新商品の薬品は、最新の科学に基づいた効果的な成分を含んでおり、顧客の課題解決に役立ちます。教育・トレーニングを通じて、販売チームが法律・規制を遵守しながら効果的にマーケティングできるようサポートします。これにより、信頼性の高い営業活動が実現します。,6,2023-07-13 23:25,2023-09-02 17:42,NULL
B2HPXK62EDXS,GOV661UC9V,NULL,68785531,最新のトレンドを捉えたこの商品は、時事ネタとのコラボレーションが魅力です。特に、注目のイベントや話題に合わせたプロモーションが行われており、消費者の関心を引きつける絶好の機会です。営業活動において、この独自性を強調することで、競合との差別化が図れます。,2,2023-07-15 18:31,2023-08-29 17:58,NULL
HAB3QNPUW22Z,T3H67ZNK3A,NULL,34993042,この商品は、顧客ニーズに基づいた柔軟な提案が可能で、プレゼンテーションの質を高める機能を備えています。部署間連携がスムーズで、交渉の際にも強力なサポートを提供し、クロージング率を向上させる要素が満載です。営業活動において、全体の効率を劇的に改善する優れたツールです。,3,2023-07-17 22:47,NULL,NULL
RYJZF1HXWSAY,JWI5KKZTHH,NULL,78555463,新商品として登場したこの金融商品は、競合分析を通じて明確な差別化ポイントを持っています。利便性や手数料の透明性が高く、顧客ニーズに応える設計が魅力です。営業活動においては、これらの特徴を強調し、顧客の信頼を得ることが成功のカギとなります。,4,2023-07-18 05:49,NULL,NULL
GJTNB7PBVAHE,ELONGGRVW6,NULL,64993416,当社の最新製品は、製造業のトレンドに即した革新的なソリューションを提供し、顧客ニーズに応えることで課題解決を実現します。効率的な生産プロセスをサポートし、コスト削減を図ることで、競争力を高めることができます。ぜひこの機会にお試しください。,4,2023-07-18 19:57,NULL,NULL
N396DTT9YOUI,M0ZN8XBGKR,NULL,80989658,新商品の医療機器は、プレゼンテーションの際にその革新的な技術を強調できる点が魅力です。交渉時には、技術サポートの充実度をアピールすることで、顧客の信頼を得やすくなります。導入後のサポート体制が整っているため、安心して提案できる商品です。,10,2023-07-19 11:41,2023-12-26 17:55,NULL
DRMRE95RYUHN,0B2JY2H068,LM9QEX3QGDTO,36393300,この商品は、流通の効率化を実現し、トレンドに敏感な市場ニーズに応えることで、イノベーションを促進します。さらに、生産性向上に寄与する機能が備わっており、営業活動を一層スムーズにサポートします。是非、導入をご検討ください！,4,2023-07-19 17:02,NULL,NULL
QF0AK8GXO98N,LPG19DRL6X,NULL,93012133,当社の薬品は、厳格な品質管理を経て提供されており、お客様の安心を第一に考えています。さらに、技術サポートが充実しているため、導入後のサポートも万全です。信頼性の高い製品をお求めの方に最適です。,4,2023-07-21 04:47,2023-08-16 15:16,NULL
QVNJ54L7B6X0,LPG19DRL6X,NULL,93012133,当社の新商品は、コスト削減と生産性向上を実現する画期的なソリューションです。最近の時事ネタを反映し、業界のニーズに応える設計が施されています。営業活動において、この商品を提案することで、顧客のビジネスを強力にサポートできるでしょう。,1,2023-07-22 17:47,NULL,NULL
ILKWQDUQA962,KJC0OZMC9P,EDKIY3A7NF9Z,50360736,当社の新しいITソリューションは、金融業界における薬品管理に特化しており、プレゼンテーション機能を活用して品質管理を強化します。これにより、業務効率を向上させ、信頼性の高いデータ分析が可能になります。ぜひ、導入をご検討ください。,3,2023-07-24 13:55,NULL,NULL
S8PIW8YUYIXJ,GZ8D27ZLIC,NULL,27750243,当社の新薬品は、過去のプロジェクトの失敗事例を踏まえ、法律・規制を遵守しつつ、イノベーションを追求した結果、効果的な提案書を作成しました。この商品は、業界のニーズに応えるだけでなく、安全性も確保しているため、営業活動において大きな強みとなります。,0,2023-07-27 23:06,2023-10-08 05:33,NULL
JFV44MYJWZEQ,BVVGZYLMT1,I7SAD034BKM6,92757274,この商品は、製造業から医療、金融、介護に至るまで幅広い業界での導入が進んでおり、最新のトレンドを反映した機能が魅力です。リード獲得からクロージングまでのプロセスを効率化し、教育・トレーニングイベントにも最適なツールです。営業チームの生産性向上に貢献すること間違いなしです。,2,2023-07-29 12:27,NULL,NULL
481JY75YPNT8,LYOC2WABA2,NULL,56361306,この商品は医療現場の課題解決に特化しており、効率的なマーケティング戦略を通じてコスト削減を実現します。導入することで、患者ケアの質を向上させながら、運営コストを大幅に削減できるため、医療機関にとって非常に魅力的な選択肢です。,11,2023-08-04 14:12,NULL,NULL
1XS9MCPOUXEQ,W2JWLI9PLD,NULL,53405714,この商品は、ITと金融分野での成功事例をもとに設計されており、教育・トレーニングにも最適です。イベントでの活用により、品質管理の向上が期待できるため、営業活動を強力にサポートします。導入することで、確実な成果を実感できるでしょう。,8,2023-08-06 19:53,2024-02-24 14:47,NULL
RU69TC3RU7KG,CEDDHWC59U,2ZNQ4QOINH6F,92467274,この商品は、IT流通におけるプロジェクト成功の鍵を握るツールです。失敗事例を分析し、効果的なコラボレーションを促進する機能が搭載されており、クロージングの精度を高めることができます。営業チームにとって必須のアイテムです。,6,2023-08-08 09:30,2024-05-26 10:02,NULL
VN21WWQ46SEK,ZE3PEUOGN1,NULL,33819417,当社の最新製品は、製造業や介護分野でのコスト削減を実現します。法律・規制に準拠した設計により、安全性と効率性を両立。プロジェクト管理をスムーズにし、業務の最適化をサポートします。,2,2023-08-09 20:32,NULL,NULL
B1SVNOSPK7IC,MCEZTT0O1J,NULL,27063854,この医療商品は、競合分析を通じてその独自性が際立っており、プレゼンテーションや交渉の際に強力な武器となります。フォローアップのプロセスもシンプルで、マーケティング戦略に組み込みやすい点が魅力的です。全体として、営業活動において高い効果を発揮する商品です。,1,2023-08-10 14:42,NULL,NULL
