post_id,product_id,parent_id,user_id,material,likes_count,created_at,updated_at,deleted_at
VB64GDOCCXRZ,6COU7Q80MD,NULL,64249803,新商品は介護業界に特化した画期的なツールで、プレゼンテーション時の失敗事例を分析し、顧客対応を改善する機能が搭載されています。リードを効率的に獲得できるイベントでの活用が期待でき、営業活動を一層効果的にサポートします。,8,2021-12-07 20:55,2023-08-15 01:52,NULL
MFXT89RT3F26,JPS87VVXZ8,NULL,34993042,当社の最新ITソリューションは、プロジェクト管理における課題解決を実現し、顧客満足度を大幅に向上させます。サプライチェーンの最適化を通じて、トレンドに敏感なビジネス環境に対応した交渉力を強化します。ぜひご検討ください。,6,2021-12-08 21:25,2023-03-27 00:07,NULL
FXH5BS36S88N,EHBMKJF7LM,NULL,44113628,当社の新商品は、顧客ニーズを的確に捉えた設計が魅力です。既存商品との違いを明確にし、失敗事例を踏まえたサービス改善が施されています。法律・規制に準拠した教育・トレーニングも充実しており、顧客対応の質を向上させることが可能です。,9,2021-12-11 21:45,2023-06-13 01:47,NULL
RNMVD3GT119E,949Z0H3KLR,NULL,92467274,この薬品は、競合製品と比較して優れた効果を持ち、顧客からの信頼も厚いです。法律・規制に準拠しているため、安全性も確保されており、リードからクロージングまでのプロセスがスムーズに進みます。顧客対応も充実しており、ニーズに応じた提案が可能です。,2,2021-12-16 00:13,2023-08-26 21:14,NULL
ZAWPJPLKQS5F,SRN9S1XR4V,NULL,42908251,新商品「連携マスター」は、製造業に特化した部署間連携を強化するツールです。過去の失敗事例を分析し、実際のニーズに基づいて設計されたため、業務効率が大幅に向上します。営業活動を通じて、導入効果を実感していただける自信があります。,2,2021-12-17 05:07,2023-01-01 09:05,NULL
VGMIPSWRYVLN,90Q9VYRVSK,NULL,81926136,この商品は、生産性向上に特化した機能を備えており、チームのコラボレーションを円滑に進めるためのツールとして非常に優れています。時事ネタに基づいた最新のアップデートも反映されており、フォローアップの効率が飛躍的に向上します。営業の現場での活用が期待できる一品です。,4,2021-12-18 12:03,2022-09-19 12:13,NULL
D3W70J8VW2IH,7RM5SKJIBV,NULL,34993042,新商品は、既存商品と比べて品質管理が徹底されており、製造業のニーズに応える設計が魅力です。成功事例も豊富で、実績に基づいた信頼性が高く、営業の現場でも自信を持って提案できる商品です。,6,2021-12-18 13:57,2022-05-24 18:52,NULL
5YCALHLLBMIJ,605S9NIHMN,NULL,71276044,当社の新製品は、ITと製造業の連携を強化し、金融業界のニーズにも対応。時事ネタを活用した効果的な顧客対応とフォローアップを実現し、部署間の連携を促進します。イベントでのデモも好評で、導入後の効果を実感いただける商品です。,5,2021-12-22 22:12,2022-11-30 19:39,NULL
QLA95EDJ0YNV,4IC88G95NO,NULL,78555463,介護業界における失敗事例を踏まえた当社の製品は、課題解決に特化した設計が施されています。サプライチェーンの最適化により、迅速な納品と安定した供給を実現し、介護現場のニーズに応えることができます。信頼性の高い商品で、業務効率を向上させるお手伝いをいたします。,3,2021-12-22 23:11,2023-06-30 21:54,NULL
ALYZBI8SXKM3,SRN9S1XR4V,NULL,80989658,この商品は、Q&Aセッションを通じて顧客の疑問を解消し、信頼を築くのに最適です。交渉の場面では、柔軟な提案が可能で、部署間連携を強化することで、よりスムーズなクロージングが実現します。ぜひ、営業活動に活用してみてください。,3,2021-12-23 16:18,2023-12-15 10:25,NULL
8F7OLR938W9W,FMYYE4KVZL,NULL,97823141,新商品は、部署間連携を強化するためのツールとして非常に効果的です。リアルタイムでの情報共有機能により、課題解決が迅速に行えるため、営業チームの生産性が向上します。時事ネタに基づいた柔軟な対応も可能で、競争力を高める一助となるでしょう。,4,2021-12-27 05:49,2022-03-20 08:28,NULL
FIYA2YNILLRT,TRMKLF7DTP,NULL,73136897,新商品は、フォローアップのプロセスを強化し、効果的なクロージングを実現するためのツールです。コラボレーション機能により、チーム全体での情報共有がスムーズになり、営業効率が向上します。これにより、顧客との関係構築が一層深まり、成約率も高まること間違いなしです。,4,2021-12-31 07:50,2023-03-16 10:32,NULL
P5ZCTK29AZO3,KJC0OZMC9P,NULL,94558255,私たちの新しい介護用薬品は、最新の法律・規制に準拠し、顧客ニーズに応える形で開発されています。競合分析を通じて得た成功事例を基に、サプライチェーンの効率化を図り、迅速な供給を実現しました。時事ネタを取り入れたマーケティング戦略で、より多くの介護施設に導入を促進しています。,8,2022-01-01 23:50,2022-07-10 22:26,NULL
FAIYEDVQI2PV,U0C8MV3ZTP,NULL,85171900,新商品は最新のトレンドを取り入れ、顧客満足度を高めるために徹底した品質管理が行われています。イベントでも注目を集め、イノベーションを感じさせるデザインが魅力です。これにより、営業活動がより効果的に進むこと間違いなしです。,6,2022-01-02 09:30,2023-04-09 09:39,NULL
NCNHEXG7H6CK,LYOC2WABA2,NULL,33648077,この商品は、製造業における課題解決に特化しており、既存商品の改善を図るためのサービスを提供します。交渉やクロージングの際にも、具体的なメリットを示すことで顧客の信頼を得やすく、成約率を高めることができます。,4,2022-01-03 21:34,2022-03-11 18:45,NULL
U46XX11X16LG,VFJNG7S0CP,NULL,98263623,新商品のプレゼンテーションは、部署間連携を強化し、マーケティング戦略を効果的に展開する絶好の機会です。営業チームがこの商品を通じて顧客ニーズに応えることで、売上向上が期待できます。全体的に、チームワークと戦略的アプローチが成功の鍵となります。,2,2022-01-04 21:55,2023-06-23 03:13,NULL
1H192U8LDITX,MCEZTT0O1J,NULL,33648077,新商品は、業務の課題解決に特化した機能を備えており、生産性向上に大きく寄与します。営業の視点から見ると、顧客に対して具体的な利点を示しやすく、クロージングもスムーズに進むでしょう。この商品は、競争力を高めるための強力なツールです。,6,2022-01-10 22:46,2023-09-20 05:48,NULL
8SFZOWOFCMT8,SRN9S1XR4V,NULL,97823141,当社の最新金融ソリューションは、コスト削減を実現しつつ、技術サポートも充実しています。これにより、効率的な資金管理が可能になり、営業活動をさらに強化できます。ぜひご検討ください！,1,2022-01-13 07:51,2023-07-22 08:34,NULL
0M3U2TAS3WU4,WK09AB9UNP,NULL,76432053,当社の新製品は、製造業の現場でのサプライチェーンの効率化を実現します。競合分析を基にしたイノベーションが特徴で、既存商品の失敗事例を踏まえた提案書を通じて、顧客のニーズに応えます。時事ネタを取り入れたアプローチで、今の市場に最適なソリューションを提供します。,2,2022-01-13 21:01,2024-05-09 00:27,NULL
QR8B1474XRTW,7RM5SKJIBV,NULL,27750243,この商品は、IT業界における交渉や競合分析に役立つツールであり、失敗事例を学ぶことで課題解決に繋がります。法律・規制を考慮した提案書作成もサポートしており、営業活動の効率を大幅に向上させることが期待できます。,2,2022-01-15 22:07,2024-01-09 16:17,NULL
1D9VYZA1ZLTR,OG6QBN656X,NULL,95265834,当社の新商品は、法律・規制に準拠しつつ、サプライチェーンの効率を最大化する設計が施されています。教育・トレーニングプログラムも充実しており、顧客対応の質を向上させるためのプレゼンテーションスキルも強化できます。部署間連携を促進し、全体の業務効率を高める一助となるでしょう。,8,2022-01-21 07:51,2023-01-11 05:15,NULL
AORPL9W3WFUR,95916MF0BS,NULL,27750243,この商品は、製造業における薬品管理を効率化し、顧客対応の質を向上させるための強力なツールです。マーケティング戦略にも活用でき、生産性向上に寄与する機能が充実しており、営業チームの業務をサポートします。,1,2022-01-22 20:38,2022-12-22 11:33,NULL
Z6CVRMNXN5XD,5DQIDYTO3T,NULL,27063854,当社の金融サービスは、介護業界に特化したサポートを提供し、顧客満足度を高めるために質の高い技術サポートを実施しています。サプライチェーンの最適化と品質管理を徹底し、安心してご利用いただける商品です。,8,2022-01-24 08:23,2023-01-27 11:16,NULL
9L6W4XOZNSEB,LZX0JLAH8X,NULL,98876028,私たちの新商品は、介護業界に特化した画期的なソリューションです。法律・規制を遵守しつつ、流通とサプライチェーンを最適化することで、生産性向上を実現。また、コラボレーション機能により、チーム全体での効率的な業務運営をサポートします。ぜひご検討ください！,2,2022-01-27 20:29,2022-04-06 03:02,NULL
W0GN8SN13WOD,7RM5SKJIBV,NULL,92467274,当社の新薬は、最新の医療トレンドに基づき開発され、顧客ニーズにしっかり応えています。部署間連携を強化し、迅速な顧客対応を実現。法律・規制を遵守しながら、リードを獲得するための強力な武器となるでしょう。,10,2022-01-28 12:47,2023-11-25 02:55,NULL
ZAL7PA0GSUL0,NYCKKQ7VEN,NULL,81926136,この商品は、競合分析を通じて明確な優位性を持ち、コスト削減と生産性向上を実現します。品質管理が徹底されているため、顧客満足度も高く、トレンドに敏感な市場でも強い支持を得ています。クロージングの際には、この点を強調することで、成約率を高めることができるでしょう。,4,2022-01-30 15:05,NULL,NULL
F0GMMITGPE9L,BN47KP5DYK,NULL,76432053,当社の新薬は、顧客ニーズに基づいた革新的なソリューションを提供し、金融業界との連携を強化します。競合分析を通じて、トレンドを捉えた提案書を作成し、部署間連携を図ることで、課題解決に貢献します。プレゼンテーションを通じて、商品の優位性を明確に伝え、信頼を築くことが可能です。,0,2022-01-30 18:12,2022-07-11 15:55,NULL
UNOZIJ9G4Y43,GZ8D27ZLIC,NULL,85171900,私たちの医療プロジェクトは、競合分析を徹底し、マーケティング戦略を最適化しました。イベントを通じて顧客との関係を強化し、サプライチェーンの効率化により、迅速な納品を実現しています。これにより、信頼性の高いサービスを提供し、競争力を高めています。,2,2022-02-01 01:34,2024-02-13 03:57,NULL
YHUK5JVT3Y96,QRJP7I1RQ7,NULL,18836861,新商品は、金融業界に特化した画期的なソリューションで、法律・規制に準拠しながら部署間連携を強化します。プロジェクト管理機能も充実しており、チームのコラボレーションを促進することで、業務効率が飛躍的に向上します。今後の成長を見込める、まさに必携のアイテムです。,0,2022-02-02 10:33,2022-09-27 21:46,NULL
WYXOGBXL9TJV,KJC0OZMC9P,NULL,81926136,この商品は、時事ネタを活用した情報提供により、営業チームの生産性を大幅に向上させます。最新のトレンドを反映したアプローチで顧客の関心を引き、効果的な提案が可能です。競合との差別化を図り、売上アップに貢献すること間違いなしです。,15,2022-02-02 22:51,2023-02-14 07:40,NULL
LU4EOI4USC05,LYOC2WABA2,NULL,88922696,この商品は、ITを活用した介護現場での成功事例を多数生み出しており、教育・トレーニングを通じてスタッフのスキル向上を実現します。さらに、コスト削減や品質管理にも寄与し、効率的な運営をサポートします。,2,2022-02-05 21:37,2024-05-27 17:28,NULL
9G1YKUOO25T7,G033Q1QI0Z,NULL,77131648,当社の製造業向けソリューションは、リード獲得から技術サポート、品質管理まで一貫したサービスを提供します。提案書も充実しており、クライアントのニーズに応じたカスタマイズが可能です。これにより、信頼性の高い製品を迅速に市場に投入できます。,6,2022-02-06 04:22,NULL,NULL
TYG4RE2PD5NL,CXK8E1UF38,NULL,01919118,この商品は、製造業と流通の現場での交渉を円滑にし、品質管理を強化するための優れたツールです。コラボレーション機能により、チーム全体がリアルタイムで情報を共有できるため、業務効率が飛躍的に向上します。営業チャンスを最大限に引き出すために、ぜひご検討ください。,5,2022-02-07 12:19,2022-02-12 17:10,NULL
HMENVV1D4SKZ,I7FC31LNPB,NULL,59233102,当社の新しいITソリューションは、金融業界に特化した機能を備えており、イベントの運営や技術サポートを円滑にサポートします。さらに、サプライチェーン管理を効率化することで、業務の生産性向上に寄与します。ビジネスの成長を加速させるこの商品をぜひご検討ください。,11,2022-02-08 23:26,2023-01-28 13:51,NULL
5IM033X17U6D,G033Q1QI0Z,NULL,93012133,新商品の営業レビューとして、製造業向けの提案書を作成しました。時事ネタを取り入れ、最近の失敗事例を分析することで、顧客対応の重要性を強調しました。法律・規制に準拠したフォローアップ体制を整えることで、信頼性を高め、顧客のニーズに応えることが可能です。,4,2022-02-09 17:17,2022-10-04 02:46,NULL
9YF96TF4A1V0,SJY28960RT,NULL,98263623,新商品の薬品は、競合分析を通じて市場でのユニークなポジションを確立しています。法律・規制を遵守しつつ、失敗事例を教訓にしたプロモーション戦略を展開。リードを獲得し、効果的なクロージングを実現するためのコラボレーションが鍵となります。,2,2022-02-10 08:08,2022-12-10 05:43,NULL
G0MTX2YLA25Y,I7FC31LNPB,NULL,00975148,新商品は、コスト削減を実現しつつ、技術サポートが充実しているため、導入後の失敗事例を大幅に減少させます。営業活動においては、顧客のニーズに応じた提案が可能で、競争力を高める強力な武器となるでしょう。,6,2022-02-15 04:28,2022-08-08 02:59,NULL
1LZ9GFKDHATK,EMO06QNXKX,NULL,23248982,医療分野におけるコラボレーション商品の導入は、効率的な治療と患者満足度の向上に貢献します。特に、チーム医療を推進することで、情報共有がスムーズになり、より迅速な意思決定が可能になります。この商品は、医療現場におけるコミュニケーションを強化し、業務の効率化を実現します。,5,2022-02-15 17:05,2022-02-15 19:33,NULL
90B4NTNUTF51,P8N7DNRO5Y,NULL,75830881,新商品は医療業界に特化したサービスで、成功事例が豊富です。リードを効率的に生成し、マーケティングイベントでのプレゼンテーションにも最適です。営業活動において、顧客のニーズに応える強力なツールとなるでしょう。,2,2022-02-22 05:09,2023-11-01 23:07,NULL
5E73ZRT1WIG9,SGI0Y3UI73,NULL,43175792,当社の新製品は、製造業の失敗事例を分析し、顧客ニーズに基づいた提案書を作成しました。競合分析を通じて、顧客対応やフォローアップの強化を図り、他社との差別化を実現。これにより、顧客満足度が向上し、リピート率も増加しています。,1,2022-02-22 05:10,2022-05-11 18:53,NULL
6UHXMUJOW2A6,FZE9INV1KK,NULL,72415063,当社の新商品は、ITトレンドを反映した高品質なソリューションで、顧客満足度を大幅に向上させることができます。生産性向上に寄与する機能が充実しており、提案書を通じて効果的なクロージングが可能です。品質管理も徹底しており、安心してお勧めできます。,3,2022-02-23 03:54,2022-05-11 21:08,NULL
7TP7S2HY801C,F8SX7C1C9V,NULL,05563425,この医療薬品は、生産性向上を目指す医療現場に最適です。マーケティング戦略を駆使して、効率的な使用法を提案し、医療従事者の負担を軽減します。信頼性と効果を兼ね備えたこの商品は、営業チームにとって強力な武器となるでしょう。,1,2022-02-23 09:25,NULL,NULL
WBRRXCU9J8N4,ELONGGRVW6,NULL,80989658,この商品は、流通プロセスを最適化することで、効率的な営業活動を実現します。品質管理が徹底されており、顧客満足度を高める要素が満載です。また、イノベーションとコラボレーションを促進する機能があり、チーム全体のパフォーマンス向上に寄与します。,4,2022-02-24 22:54,2024-08-28 16:40,NULL
SRHDYRIBET4Z,2809P8I08J,NULL,59233102,当社の新商品は、金融業界向けに特化した流通ソリューションを提供し、プロジェクト管理を効率化します。競合分析を通じてコスト削減を実現し、品質管理を強化することで、パートナーとのコラボレーションを促進します。ビジネスの成長をサポートする最適な選択肢です。,7,2022-03-02 18:32,2023-06-23 14:17,NULL
VGOOVOLXMKZK,JWI5KKZTHH,NULL,77131648,当社の新商品は、最新の時事ネタを反映した機能を備え、競合他社と比較しても優れた課題解決能力を発揮します。法律・規制を遵守しながら、顧客のニーズに応えることで、信頼性と安心感を提供します。ぜひこの機会にご検討ください。,4,2022-03-04 22:25,2023-04-21 09:41,NULL
7FZ8JWBQOMZB,1G1U3KXOEJ,NULL,78555463,当社の新しい金融ソリューションは、流通業界におけるコスト削減を実現し、法律・規制に準拠した安心感を提供します。成功事例を基にしたプレゼンテーションで、イノベーションを強調し、時事ネタに即したマーケティング戦略を展開します。これにより、競争力を高めることが可能です。,3,2022-03-05 14:22,2023-01-24 20:31,NULL
6WE26IMPHSPT,FMYYE4KVZL,NULL,98263623,当社の新製品は、製造業のニーズに応える高性能なソリューションです。交渉時に得られる独自のメリットを強調し、部署間連携を促進することで、業務効率を大幅に向上させます。時事ネタに関連した機能も搭載しており、競争力を維持するための必須アイテムです。,10,2022-03-07 04:05,2022-04-16 19:46,NULL
SDQT2WGZ4Z29,QJQ74NXF0K,NULL,76432053,私たちの金融商品は、競合分析を基に設計されており、顧客満足度を優先した機能を備えています。提案書を通じて、クライアントとのコラボレーションを強化し、ニーズに応じた最適なソリューションを提供します。これにより、信頼性と満足度の向上を実現しています。,0,2022-03-10 18:47,NULL,NULL
GM6SHZDXLSS9,U0C8MV3ZTP,NULL,00975148,この商品は既存商品として市場に出ており、過去の失敗事例を踏まえた改善がなされています。マーケティング戦略も洗練されており、ターゲット層に響くメッセージを発信しています。営業の視点から見ても、顧客ニーズに応える優れた選択肢です。,2,2022-03-15 04:52,2023-02-07 17:00,NULL
F4DZGOFU7SVB,M8SMLGUTSE,NULL,64249803,新商品は、時事ネタを反映した画期的な機能を搭載しており、部署間の連携を強化します。課題解決に特化した提案書を通じて、顧客のニーズに応え、効果的なクロージングを実現することが可能です。,3,2022-03-15 22:50,2023-12-07 17:21,NULL
DF5WXJU1TWM4,1G1U3KXOEJ,NULL,27063854,当社の新商品は、コスト削減を実現しながら、効率的なサプライチェーンを構築できる優れたソリューションです。教育・トレーニングプログラムを通じて、チーム全体のスキル向上を図り、交渉力を強化します。時事ネタを活用した提案書も用意しており、クライアントのニーズに応じた柔軟なアプローチが可能です。,2,2022-03-22 05:36,2022-12-08 19:32,NULL
TUDFU60T3HBT,GOV661UC9V,NULL,59233102,この商品は、既存商品としての信頼性が高く、サービス面でも顧客満足度を追求しています。交渉時の柔軟性と、厳格な品質管理が施されているため、長期的なパートナーシップを築く上で非常に魅力的です。営業の視点から見ても、競争力のある提案が可能です。,5,2022-03-23 19:52,2023-07-28 04:00,NULL
GHMDBPCY1PTC,FGDSVCL06J,NULL,49780674,新商品は、IT業界でのマーケティング戦略を強化するための強力なツールです。技術サポートが充実しており、導入後の運用もスムーズ。営業チームにとって、顧客ニーズに即した提案が可能となり、成約率向上に貢献します。,7,2022-03-28 07:50,2023-02-10 06:54,NULL
BHFVP068CG77,G4J90885G4,NULL,53405714,新しい金融商品は、介護業界のニーズに応え、将来のトレンドを先取りしています。柔軟な資金運用が可能で、安心して介護サービスを提供できる環境を整えます。これにより、顧客の信頼を得る絶好のチャンスです。,11,2022-03-29 13:02,2023-05-07 18:21,NULL
PMND894GGI70,4IC88G95NO,NULL,68785531,この商品は介護業界に特化した教育・トレーニングツールで、顧客対応のスキル向上に役立ちます。イベントでの実践的なクロージングテクニックを学ぶことで、営業成績が向上し、信頼関係を築くことが可能になります。介護現場でのニーズに応える優れた選択肢です。,9,2022-03-30 07:49,2023-07-13 07:01,NULL
MOI6MFGL67GR,8MNXS50JH3,NULL,53405714,新商品は、プロジェクトのニーズに応じた柔軟な対応が可能で、フォローアップ体制も充実しています。品質管理が徹底されており、安心してお客様に提案できる一品です。これにより、顧客満足度の向上が期待できます。,0,2022-04-01 03:51,2023-12-19 16:23,NULL
I2GFUMS3S0GQ,QRJP7I1RQ7,NULL,49780674,私たちの新商品は、コスト削減と品質管理を両立させることができ、顧客ニーズに応える設計がされています。最近のイベントでの失敗事例を踏まえ、マーケティング戦略を見直し、より効果的なアプローチを実現しました。時事ネタを活用したプロモーションも行っており、今後の成長が期待されます。,2,2022-04-05 11:18,2024-06-05 11:47,NULL
2218QPGKRJCL,QB5VHY9IQR,NULL,72415063,新しい医療機器は、最新のイノベーションを取り入れ、厳しい法律・規制をクリアしています。時事ネタとして、最近の医療ニーズに応えるために設計されており、営業活動においても高い関心を集める商品です。ぜひご検討ください。,0,2022-04-12 07:08,2022-08-12 18:45,NULL
D0MBX96Q3Z7G,8YY30KHEHG,NULL,94558255,当社の製品は、製造業における高い品質管理を実現し、流通プロセスを最適化することで顧客満足度を向上させます。プレゼンテーションを通じてその優れた特長をお伝えし、信頼性のあるパートナーとしての地位を確立しています。,1,2022-04-13 22:00,2024-01-16 14:13,NULL
X59K1DEW1XBW,NYCKKQ7VEN,NULL,37112060,この商品は、流通の効率性を高めるために設計されており、部署間連携を強化する機能が充実しています。競合分析を通じて得たデータを基に、品質管理も徹底しており、フォローアップ体制も整っています。これにより、顧客満足度を向上させ、リピート率を高めることが期待できます。,1,2022-04-15 16:01,NULL,NULL
