post_id,product_id,parent_id,user_id,material,likes_count,created_at,updated_at,deleted_at
KLXPKIR1937N,05R46SIJHY,NULL,88922696,新商品「コンプライアンスガイド」は、法律・規制の最新情報を提供し、企業の課題解決をサポートします。時事ネタを反映した内容で、営業活動におけるリスクを軽減し、顧客への信頼性を高める強力なツールです。これにより、営業チームは安心して提案ができる環境を整えられます。,1,2023-12-14 09:05,NULL,NULL
UX3BBLFCY3I8,P0PVKWMFWR,NULL,64993416,当社の新商品は、部署間連携を強化し、プロジェクトの進行をスムーズにする設計がされています。フォローアップ機能により、顧客ニーズに迅速に対応でき、顧客満足度を向上させることが可能です。また、法律・規制に準拠した安心感も提供しており、ビジネスにおける信頼性を確保します。,2,2023-12-14 15:41,NULL,NULL
IGTBMYJLT5ZN,BN47KP5DYK,NULL,97823141,この商品は、最新のIT技術を駆使しており、マーケティング戦略を革新する力を持っています。使いやすさと高い効果を兼ね備え、顧客のニーズに応える柔軟性も魅力です。営業チームにとって、競争力を高める必須アイテムと言えるでしょう。,9,2023-12-19 13:53,NULL,NULL
UXKEKB6ULWXN,ELONGGRVW6,NULL,23248982,私たちのタグ情報サービスは、プロジェクトの成功事例を豊富に持ち、品質管理を徹底しています。これにより、顧客のニーズに応じた最適なソリューションを提供し、営業活動を効果的にサポートします。信頼性の高いデータ管理で、ビジネスの成長を促進します。,10,2023-12-21 09:12,NULL,NULL
H9EHE6USQX6M,ZYY0BEKQK6,NULL,29372843,当社のITソリューションは、医療業界の特有の課題を解決するために設計されています。プロジェクト管理機能を活用することで、効率的なイベント運営が可能になり、医療現場のニーズに応じた柔軟な対応が実現します。これにより、クライアントの信頼を獲得し、業務の生産性を向上させます。,5,2023-12-24 00:16,NULL,NULL
FVNYJNG6X5U9,H1GE9OEZHN,Q63DO6HYX9X2,23248982,当社の最新商品は、優れた技術サポートを提供し、サプライチェーン全体での効率を最大化します。これにより、顧客は安心して導入でき、営業チームは迅速な対応で信頼を築けます。ぜひこの機会に、他社との差別化を図りましょう。,4,2023-12-24 06:04,NULL,NULL
51I8C2FIF77I,FGDSVCL06J,NULL,43979678,私たちの製造業向け薬品は、高い顧客満足度を誇り、サプライチェーンの最適化にも寄与します。効率的な流通と品質管理により、安心してご利用いただける商品を提供し、業務の生産性向上に貢献します。,2,2023-12-26 06:07,NULL,NULL
KX34XE8242IP,1I69H29M8Z,NULL,92757274,当社の新商品は、コスト削減を実現しながらも品質管理を徹底しています。成功事例として、特定のイベントでの導入により顧客満足度が向上しましたが、法律・規制に関する失敗事例もあり、今後の改善点として捉えています。営業活動においては、これらの情報を活用し、顧客への信頼性を高めることが重要です。,1,2023-12-27 16:02,NULL,NULL
8XP205X59I46,0B2JY2H068,WUN44Q3F64YA,49780674,当社の医療商品は、顧客対応を重視し、既存の商品をさらに進化させました。イベントでのデモンストレーションを通じて、実際の使用感を体験できるため、信頼性が高まります。ぜひ、これを機にお試しください！,2,2023-12-27 16:41,NULL,NULL
R2AQOFDF82IA,GZ8D27ZLIC,NULL,43979678,当社の製品は、製造業や医療、金融分野での導入実績が豊富で、成功事例も多数あります。競合分析を通じて、他社製品に比べて優れた性能とコストパフォーマンスを実現。イベントでのデモンストレーションを通じて、顧客との交渉をスムーズに進めることができる点も強みです。,8,2023-12-27 18:27,2024-07-24 00:53,NULL
MFN0Q61T14DR,1G1U3KXOEJ,NULL,00975148,私たちの新しい製品は、製造業における薬品管理を最適化し、失敗事例を大幅に減少させることができます。イベントを通じての導入セミナーでは、コスト削減と生産性向上の具体的な事例を紹介し、法律・規制にも完全に準拠した安心感を提供します。ぜひご検討ください。,4,2023-12-28 03:14,NULL,NULL
04RMH2HH1JKP,6SGI8ZGM1S,NULL,81926136,新商品の導入により、部署間連携がスムーズになり、マーケティング活動が効率化されました。最新のトレンドを取り入れたこの商品は、時事ネタにも敏感に反応し、法律・規制に準拠した安心感を提供します。イベントでのプレゼンテーションでも高評価を得ており、営業の現場での活用が期待されます。,6,2023-12-31 00:10,NULL,NULL
IS5X1BXDVVMH,NU212I8EAW,NULL,27063854,当社の製品は、製造業に特化したプレゼンテーションツールで、時事ネタを取り入れた成功事例を紹介することで、顧客対応を一層強化します。教育・トレーニング機能も充実しており、提案書作成の効率を大幅に向上させることができます。これにより、プロジェクトの成功率が高まること間違いなしです。,8,2023-12-31 15:18,NULL,NULL
L9L9I33QCWMQ,QJQ74NXF0K,NULL,33819417,この商品は、ITと製造業のニーズを的確に捉えたサービスで、顧客満足度を向上させるための教育・トレーニングプログラムを提供します。法律・規制に準拠した内容で、安心して導入できる点も大きな魅力です。営業の視点から見ても、競争力を高めるための必須アイテムと言えるでしょう。,5,2024-01-04 19:20,2024-01-21 08:30,NULL
BG6EWA1FCQZ5,2809P8I08J,NULL,04125772,この商品の特長は、顧客ニーズに基づいた高品質な製造業向けソリューションを提供する点です。提案書を通じて、クライアントとのコラボレーションを深め、効果的なクロージングを実現できます。マーケティング戦略を駆使して、競争力を高める一手となるでしょう。,6,2024-01-07 15:25,NULL,NULL
PP6Q4IXJTF24,GZ8D27ZLIC,R2AQOFDF82IA,72415063,当社の新商品は、金融業界に特化した介護支援ツールで、部署間連携を強化し、顧客対応を効率化します。リード管理機能と提案書作成の自動化を実現し、チーム内のコラボレーションを促進することで、より効果的な営業活動をサポートします。,6,2024-01-07 18:22,2024-05-05 23:45,NULL
RBW09STGKIMW,KJC0OZMC9P,OC64XORMDNEN,34993042,新商品は、顧客ニーズに応じた柔軟な金融ソリューションを提供します。特に、リスク管理や資産運用を重視する方に最適で、実績あるサポート体制が魅力です。これにより、顧客の信頼を得やすく、営業成績の向上が期待できます。,1,2024-01-08 14:38,NULL,NULL
ICKHRJO1S7AU,0B2JY2H068,NULL,93852109,新商品は、部署間連携を強化し、成功事例を基にした具体的な提案書を提供します。コスト削減を実現しつつ、法律・規制にも完全に準拠しているため、安心して導入可能です。失敗事例も分析し、リスクを最小限に抑えた営業戦略をサポートします。,5,2024-01-12 12:28,NULL,NULL
7ISJQ89O4031,M0ZN8XBGKR,NULL,44113628,この商品は、顧客のニーズを的確に捉えたトレンドを反映しており、マーケティング戦略においても優れた効果を発揮します。品質管理が徹底されているため、課題解決に繋がる信頼性が高く、顧客対応もスムーズです。営業活動において、強力な武器となること間違いなしです。,4,2024-01-12 12:35,NULL,NULL
Z6NJH1AMA3R5,EMO06QNXKX,NULL,95265834,当社の新商品は、介護現場での生産性向上を実現するイノベーションを提供します。イベントでのデモを通じて、その使いやすさと効果を実感していただける機会を設けています。ぜひご参加いただき、介護の未来を共に切り拓きましょう！,2,2024-01-14 14:53,NULL,NULL
JSRB8XI3LAI9,90Q9VYRVSK,NULL,59233102,私たちの新商品は、コスト削減を実現しながらも、失敗事例を分析した上で開発されたため、マーケティングイベントでの成功率が高まります。営業の視点から見ても、競合他社に比べて優位性を持つため、顧客への提案がしやすく、売上向上に寄与します。,8,2024-01-17 01:43,NULL,NULL
S72ZJZWRJOQS,6JWL966BHE,NULL,97823141,この商品は、顧客対応の質を向上させるためのプロジェクトに最適です。マーケティング戦略と連携し、ターゲット層にアプローチできる機能が充実しており、営業活動を効率化します。ぜひ導入を検討してみてください。,4,2024-01-17 06:57,NULL,NULL
940CXLHU4LH9,AFM30TRIXQ,NULL,36393300,この商品は、顧客満足度を高めるための優れた機能を備えており、営業の現場でのクロージング率を向上させることができます。タグ情報が豊富で、ターゲット層に応じたアプローチが可能なので、営業活動を効率的にサポートしてくれるでしょう。,4,2024-01-20 19:37,NULL,NULL
M27DCT35BMYQ,GOV661UC9V,NULL,93012133,この商品は、金融分野の失敗事例を学ぶことで、営業チームの課題解決能力を高める教育・トレーニングに最適です。具体的なケーススタディを通じて、実践的なスキルを身につけることができ、結果として成約率の向上が期待できます。,12,2024-01-21 19:07,NULL,NULL
AUO66AZTA98U,BAZ0PHOGRC,I2C7Z9LMKVH2,50360736,私たちの新商品は、部署間連携を強化し、プロジェクト管理を効率化するために設計されています。顧客対応の質を向上させる機能が充実しており、品質管理のプロセスも一元化されています。これにより、営業チームは顧客ニーズに迅速に応えることができ、成果を最大化できます。,3,2024-01-22 11:49,2024-06-06 20:36,NULL
060EFJS3J5SE,95916MF0BS,T73HQYATK7TO,93852109,当社の新しいコラボレーションツールは、IT部署間の連携を強化し、教育・トレーニングを通じて顧客ニーズに応えることができます。法律・規制に準拠した設計により、顧客満足度も向上。ぜひこの機会にお試しください！,6,2024-01-24 01:11,NULL,NULL
GPU7HFYWJE26,5DQIDYTO3T,NULL,01919118,当社の商品は、顧客満足度を高めるために、フォローアップの重要性を強調しています。失敗事例を分析し、提案書を基に改善策を講じることで、営業活動の質を向上させています。これにより、顧客との信頼関係を築き、リピート率の向上に繋がっています。,0,2024-01-26 22:54,NULL,2024-06-21 04:58
R7HS7Y6G0WB9,H1GE9OEZHN,NULL,98263623,当社の新商品は、コスト削減を実現しつつ、品質管理を徹底しています。最新の法律・規制にも準拠しており、時事ネタを取り入れた提案書を通じて、イベントでのリード獲得を促進します。これにより、顧客のニーズに応える最適なソリューションを提供します。,7,2024-01-27 16:43,NULL,NULL
1V02MVN11WUI,95916MF0BS,NULL,77131648,当社の新しい金融ソリューションは、IT技術を駆使して流通業界の効率を劇的に向上させます。競合分析に基づいた独自のフォローアップ機能を搭載し、法律・規制にも完全対応。業界のニーズに応えることで、信頼性と競争力を高めることができます。,3,2024-01-27 22:24,2024-07-25 01:41,NULL
AMQHKRSHZ3LD,LYK5RZ5JJW,NULL,73136897,この商品は、金融業界での交渉や部署間連携を強化するためのプロジェクト管理ツールです。マーケティングイベントの効果を最大化し、クロージング率を向上させる機能が充実しており、営業チームにとって必須のアイテムです。,6,2024-01-29 10:28,NULL,NULL
EREYM5RP12AP,D1AOBXGZ7Q,NULL,00975148,この商品は介護業界に特化したサービスで、既存商品との連携がスムーズです。流通経路も確立されており、法律・規制に準拠した安心感があります。マーケティング戦略を駆使してリードを効果的に獲得できるため、交渉の際にも強みを発揮します。,5,2024-02-03 21:32,NULL,NULL
PO6AXWISIC7X,7PSWVYBZQX,NULL,85171900,新商品は医療分野におけるフォローアップ機能が充実しており、顧客満足度を大幅に向上させるイノベーションを提供します。この革新的なアプローチにより、リードの管理が効率化され、営業活動の質が向上します。,5,2024-02-05 09:35,2024-03-28 12:04,NULL
LFZ4M3NFUOQU,MCEZTT0O1J,NULL,49780674,当社の新商品は、他部署との連携を強化し、顧客ニーズに応えるサービスを提供します。営業チームが得たフィードバックを基に、商品知識を深めることで、より効果的な提案が可能になります。これにより、顧客満足度が向上し、成約率も高まることが期待できます。,6,2024-02-06 03:56,2024-03-25 11:08,NULL
71KHB13UR8QJ,NYCKKQ7VEN,NULL,64249803,私たちの商品は、顧客ニーズを的確に捉えた高品質なソリューションを提供し、流通の効率化を実現します。成功事例として、コスト削減を実感したクライアントからの高評価が続出。顧客対応も迅速で、信頼性の高いパートナーとして選ばれています。,7,2024-02-06 11:43,2024-03-29 02:30,NULL
YG7VCQLK8DF6,P0PVKWMFWR,YFQRGM9E4Q7I,75830881,この商品は、流通とサプライチェーンの効率を大幅に向上させるために設計されており、顧客ニーズに応じた柔軟な対応が可能です。マーケティング戦略に組み込むことで、競争優位性を確保し、生産性を飛躍的に向上させる提案書としても最適です。,3,2024-02-08 21:45,NULL,NULL
JOWWVE0EOI39,P0PVKWMFWR,NAXM5FROWXJM,23248982,新商品は、介護現場における薬品の流通を効率化し、生産性向上に寄与します。競合分析を通じて、他社製品と比較して優れた特長を持ち、リード獲得にも効果的です。交渉の際には、これらの利点を強調することで、顧客の信頼を得やすくなります。,5,2024-02-09 11:20,NULL,NULL
8DG3361B4K3O,95916MF0BS,T73HQYATK7TO,05563425,このIT教育・トレーニング商品は、プレゼンテーションスキルを向上させるための優れたツールです。実践的な演習を通じて、営業チームが顧客に対して魅力的な提案を行えるようサポートします。効果的なコミュニケーションを実現し、成約率を高めるための必須アイテムです。,3,2024-02-11 13:09,NULL,NULL
DR1K2APQUGPD,0T9YTA9E3C,NULL,88977777,当社の新商品は、最新のトレンドを取り入れたデザインと機能性を兼ね備えています。顧客の課題を解決し、高い顧客満足度を実現するために、フォローアップを重視したサポート体制も整えています。ぜひこの機会にお試しください！,8,2024-02-12 20:56,NULL,NULL
PJG8MV0LLNR4,BN47KP5DYK,NULL,80989658,この商品は、最新の時事ネタを反映した高品質な教材で、顧客対応やフォローアップにも優れています。教育・トレーニングのプロジェクトに最適で、品質管理が徹底されているため、安心して導入できます。営業チームの成果を最大化するための強力なツールです。,4,2024-02-13 01:09,NULL,NULL
S3Y8XX1F5BJ3,TZHCJSEL0G,OBVEN9VIVJTM,53405714,私たちの新商品は、競合分析を通じて見つけた市場のニーズに応え、コスト削減を実現します。失敗事例を参考にしたフォローアップ体制を整え、サプライチェーンの効率を高めることで、エンジニアの皆様にも満足いただける品質を提供します。リード獲得の際には、この強みを前面に押し出していきましょう。,4,2024-02-16 16:48,NULL,NULL
7SWIHVNHJ899,H1GE9OEZHN,L8FWEL22QXFU,92757274,この商品は、営業チームの生産性向上に特化しており、顧客対応や課題解決に役立つ機能が充実しています。教育・トレーニングの要素も含まれているため、新人営業マンでもスムーズにプレゼンテーションやクロージングが行えます。全体として、営業活動を効率化し、成果を上げるための強力なツールです。,4,2024-02-18 19:01,NULL,NULL
9MW9RQB8X7L4,EHBMKJF7LM,ODIAJII1KG5Z,93012133,この商品は、部署間連携を強化し、プロジェクトの進行をスムーズにします。顧客ニーズに応じたカスタマイズが可能で、営業チームにとっては大きな武器となります。効率的な営業活動を実現し、顧客満足度を向上させることが期待できます。,10,2024-02-21 13:15,2024-07-14 03:55,NULL
728MDBVAOY2O,VFJNG7S0CP,U46XX11X16LG,61655575,新しい介護支援ツールは、製造業の効率を向上させ、介護現場でのイノベーションを促進します。成功事例として、導入後のリードタイム短縮が報告されており、失敗事例を参考にすることで、よりスムーズなプロジェクト進行が可能です。この商品は、時事ネタを反映した機能も備えており、現場のニーズに応えています。,2,2024-02-22 18:27,NULL,NULL
Y6CXOPOW2KIE,605S9NIHMN,NULL,85171900,当社の新商品は、最新の時事ネタを反映した機能を搭載し、顧客ニーズに応える設計になっています。流通イベントでのリード獲得にも最適で、営業活動を効率化するツールとして大変有用です。ぜひこの機会にお試しください！,8,2024-02-22 20:20,NULL,NULL
Y793I0LCZPC1,T3H67ZNK3A,NULL,64249803,この金融商品は、流通業界のニーズに特化しており、部署間連携を強化するための機能が充実しています。提案書を基にしたクロージングを行うことで、顧客にとってのメリットを明確に伝え、コラボレーションの可能性を広げることができます。既存商品とのシナジー効果も期待できるため、営業チャンスが増加します。,3,2024-03-02 21:40,NULL,NULL
62DFOCHXD6LL,90Q9VYRVSK,NULL,92467274,私たちの新商品は、最新の時事ネタを反映し、顧客ニーズに応える形で設計されています。イベントでの活用も想定し、生産性向上に寄与する機能が盛り込まれています。顧客対応の効率を高め、満足度を向上させるための理想的なソリューションです。,1,2024-03-03 10:51,NULL,NULL
E9ACSHL7YZDQ,HGF68IXOY4,50VCLYTILP2E,50360736,当社の最新金融ソリューションは、競合分析を通じて顧客ニーズを的確に捉え、マーケティング戦略を革新します。コラボレーション機能も充実しており、チーム全体での効果的な営業活動を実現します。これにより、顧客の期待を超えるサービスを提供できるでしょう。,2,2024-03-06 03:14,NULL,NULL
LL1T6I1NGFFI,EHJCH2PO4U,NULL,71276044,当社の新しいソリューションは、製造業と金融業界のニーズに応え、サプライチェーン全体の生産性向上を実現します。提案書に基づいたカスタマイズ可能な機能により、効率的な業務運営が可能となり、競争力を強化します。,7,2024-03-08 08:10,2024-07-14 00:00,NULL
29QVB5TG2N52,VP81LYMP8C,NULL,76432053,当社の新製品は、顧客ニーズに基づいたイノベーションを取り入れ、コスト削減を実現します。効率的なプロセスを提供することで、ビジネスの成長をサポートし、競争力を高めることができます。ぜひこの機会にお試しください！,2,2024-03-10 02:25,NULL,NULL
4PZFD2EBVSTA,H1GE9OEZHN,L8FWEL22QXFU,53405714,この商品は、トレンドを先取りしたイノベーションを取り入れたもので、交渉の際にも強力なリードを提供します。失敗事例を分析し、フォローアップを徹底することで、クロージング率を高めることができるため、コラボレーションを通じてさらなる成功を目指せます。,8,2024-03-10 05:40,2024-08-17 13:35,NULL
SAPHRO9NPMJI,G4J90885G4,S7YLI2PZZREY,59233102,このIT薬品は、顧客ニーズに応じた機能を備えており、プレゼンテーションでの説得力が抜群です。クロージングの際も、顧客満足度を高めるためのサポートが充実しており、信頼性の高い選択肢となります。,4,2024-03-11 22:32,NULL,NULL
AA6TAUL632ZF,AFM30TRIXQ,NULL,43175792,当社の新商品は、介護現場での部署間連携を強化し、業務効率を向上させるためのイノベーションを実現しました。直感的な操作性とリアルタイムの情報共有機能により、スタッフ間のコミュニケーションが円滑になり、利用者へのサービス向上に寄与します。ぜひご検討ください。,1,2024-03-17 17:28,NULL,NULL
79WJA14Z1OF9,P8N7DNRO5Y,T8EQZC74UX5A,85171900,当社のIT医療ソリューションは、最新の時事ネタを反映した機能を搭載し、競合分析に基づいて優れたパフォーマンスを発揮します。サプライチェーンの最適化により、エンジニアリングチームの効率も向上し、クライアントのニーズに応えるための強力なツールとなっています。クロージングの際には、これらのメリットを強調し、信頼性をアピールすることが鍵です。,4,2024-03-18 00:12,2024-07-28 19:52,NULL
I174QKCDYJRX,NYCKKQ7VEN,NULL,95265834,最新のIT医療薬品は、競合分析を通じて市場のトレンドを捉えたイノベーションが詰まっています。営業の視点から見ると、これらの製品は顧客のニーズに応えるだけでなく、効率的な営業戦略を展開するための強力な武器となります。市場の変化に柔軟に対応できる点が、他社製品との差別化要因です。,4,2024-03-29 01:08,NULL,NULL
YPGZ6M0A64PD,FUFUUGO1YZ,NULL,01919118,当社の介護商品は、顧客対応に優れたサポート体制を整えており、利用者のニーズに的確に応えます。また、品質管理に徹底しており、安心して使用できる製品を提供。クロージングもスムーズで、顧客満足度が高いのが特徴です。,3,2024-03-31 00:41,NULL,NULL
GWRDJRGG85I5,3SRQL49KKL,NULL,01919118,当社の医療関連商品は、顧客ニーズに基づいた高品質なソリューションを提供し、リードタイムの短縮とコスト削減を実現します。技術サポートも充実しており、サプライチェーン全体を通じて品質管理を徹底。信頼性の高いパートナーとして、貴社のビジネスをサポートします。,1,2024-03-31 00:50,NULL,NULL
UGIQCPCU9K7Y,UEERLUHS6Q,NULL,49780674,この商品は、顧客のニーズに応えるために設計されており、使いやすさと高性能を兼ね備えています。営業チームは、顧客対応を通じて得たフィードバックを活かし、商品の魅力を最大限に引き出すことができます。信頼性の高いサポート体制も整っており、購入後の安心感を提供します。,4,2024-04-04 03:35,NULL,NULL
82XC3UM4US5T,7GJOXNES7Z,1IAAM1UKTCRA,98876028,新商品は、部署間連携を強化し、効率的な品質管理を実現します。営業チームにとって、これにより顧客への提案がスムーズになり、信頼性の高い商品を提供できる点が大きな魅力です。ぜひ、この新商品を活用して、売上向上を目指しましょう。,3,2024-04-04 22:16,NULL,NULL
BSYQI050E4MS,90Q9VYRVSK,NULL,56361306,当社の新商品は、顧客ニーズを的確に捉えた設計で、競合分析を基にした優れた機能を搭載しています。サプライチェーンの最適化により生産性向上を実現し、顧客対応の迅速性も向上しました。これにより、他社製品と比較して明確な優位性を持つことができます。,1,2024-04-06 23:51,NULL,NULL
OVXSP34T0P8T,GOV661UC9V,TUDFU60T3HBT,27750243,当社の介護支援商品は、部署間連携を強化し、顧客満足度を向上させるために設計されています。過去の失敗事例を踏まえ、法律・規制にも準拠しており、安心して営業活動に活用できます。この商品を通じて、より良いサービス提供が実現できるでしょう。,10,2024-04-07 03:43,NULL,NULL
