post_id,product_id,parent_id,user_id,material,likes_count,created_at,updated_at,deleted_at
AWPBYIKZU2IZ,AFM30TRIXQ,NULL,88922696,当社の新薬は、流通の効率化を実現し、顧客対応の迅速化に寄与します。成功事例として、多くの医療機関での導入実績があり、課題解決に向けたイノベーションを提供。フォローアップ体制も整っており、信頼性の高いパートナーとして選ばれています。,6,2022-08-27 02:16,2023-10-24 17:54,NULL
T73HQYATK7TO,95916MF0BS,NULL,22527715,当社の新しいIT医療ソリューションは、流通プロセスを最適化し、品質管理を強化します。顧客ニーズに応じたカスタマイズが可能で、業界の変化にも柔軟に対応。信頼性の高いパートナーとして、貴社の業務効率を向上させること間違いなしです。,6,2022-08-28 08:01,2022-09-01 14:38,NULL
1UEORO0B111R,2BQN5S015F,NULL,43175792,当社の新しい介護支援システムは、部署間連携を強化し、顧客ニーズに応じたサービスを提供します。これにより顧客満足度が向上し、円滑なコラボレーションを実現します。営業チームとして、この革新的な商品をぜひお勧めします！,10,2022-08-28 09:47,2023-05-10 19:14,NULL
F9NM2CVXZX4Q,LPG19DRL6X,NULL,00975148,当社の新しい金融ソリューションは、部署間連携を強化し、プロジェクト管理を効率化することで、顧客満足度を向上させます。競合分析を通じてコスト削減を実現し、サプライチェーンの最適化と品質管理にも貢献します。これにより、ビジネス全体のパフォーマンスを向上させることが可能です。,9,2022-08-28 11:12,2024-01-31 02:34,NULL
LR29BL4LGQ4N,2BQN5S015F,NULL,01919118,当社の製品は、製造業や薬品業界に特化した教育・トレーニングプログラムを提供し、品質管理の向上を図ります。顧客ニーズに基づいたカスタマイズが可能で、実践的なスキルを身につけることで業務効率が大幅に向上します。信頼性の高いサポートを通じて、貴社の成長をサポートします。,2,2022-08-28 17:31,2024-08-30 04:19,NULL
417NLJGD2Q3X,GZ8D27ZLIC,NULL,78555463,このIT薬品は、業界内での成功事例が豊富で、効率的な営業活動をサポートします。特にデータ分析機能が優れており、顧客ニーズを的確に把握できるため、成約率が向上します。営業チームにとって、強力な武器となること間違いなしです。,3,2022-08-30 20:44,2022-11-27 00:15,NULL
ODE2MNRP6MRF,90Q9VYRVSK,NULL,50360736,この商品は、IT業界に特化したプレゼンテーションツールで、成功事例を豊富に取り入れており、フォローアップ機能も充実しています。マーケティング戦略を強化し、顧客との関係構築に役立つため、営業活動において非常に効果的です。,2,2022-08-31 22:31,NULL,NULL
LW3W0ZMF3QL6,7GJOXNES7Z,NULL,53405714,この商品は、既存商品としての信頼性を持ちながら、最新のトレンドを取り入れたイノベーションが光ります。成功事例も豊富で、顧客満足度が高く、競合分析を行った結果、品質管理が徹底されているため、クロージングもスムーズです。営業活動において、自信を持ってお勧めできる一品です。,4,2022-09-01 10:45,2022-09-28 19:35,NULL
GFD9E9DW8KC3,1G1U3KXOEJ,NULL,72415063,新商品「エコフレンドリーボトル」は、競合製品と比較して優れた耐久性とデザイン性を兼ね備えています。プロジェクトチームの努力により、環境への配慮も徹底されており、顧客のニーズに応える理想的な商品です。営業活動において、これらのポイントを強調することで、顧客の関心を引くことができます。,2,2022-09-14 23:53,2022-09-26 15:20,NULL
5OW44W9HKWE6,949Z0H3KLR,NULL,36393300,当社の介護関連商品は、法律・規制を遵守しつつ、品質管理を徹底しています。顧客満足度を高めるために、イベントでのデモを通じて提案書を活用し、具体的なニーズに応えることが可能です。信頼性のあるサービスを提供し、介護現場の効率化をサポートします。,2,2022-09-16 20:07,2023-05-31 00:19,NULL
ZF27F7MLUQDV,7GJOXNES7Z,NULL,75830881,最新のIT介護ソリューションは、業界のトレンドを反映し、効率的なプレゼンテーションを可能にします。失敗事例を分析し、リード獲得に役立つ提案書を活用することで、競争力を高めることができます。今こそ、革新的なアプローチで市場にアプローチしましょう。,8,2022-09-17 08:21,2024-03-29 23:14,NULL
7CG64N2VYJ29,CEDDHWC59U,NULL,29372843,私たちのIT薬品ソリューションは、プロジェクトの効率を飛躍的に向上させ、顧客満足度を高めることができます。データ管理や分析が簡単になり、迅速な意思決定をサポート。ぜひ一度お試しください！,5,2022-09-19 10:22,2023-02-03 00:25,NULL
BLNWAJCZGEMY,Q0WOPM4JJW,NULL,93852109,当社の商品は、競合分析を通じて市場での優位性を確立し、教育・トレーニングを通じて顧客の理解を深めます。法律・規制を遵守しつつ、サプライチェーンの効率化を図ることで、顧客満足度を高めることができます。これにより、信頼性の高いビジネスパートナーとしての地位を強化します。,9,2022-09-20 05:35,2023-11-04 11:03,NULL
KQI0C0S7TTHF,DE020WWO3X,NULL,93012133,この薬品は、顧客ニーズに基づいて開発されており、流通の効率性を最大限に活かしています。交渉の際には、他社製品と比較して優れた効果を強調できるため、営業トークが非常にスムーズです。顧客の信頼を得るための強力な武器となるでしょう。,5,2022-09-20 13:27,2022-10-15 13:37,NULL
MRB8392C7E6V,LYK5RZ5JJW,NULL,00975148,この商品は、ITと医療、介護の分野での顧客ニーズに応えるために設計されており、教育・トレーニングやイベントでの活用にも最適です。マーケティング戦略を強化し、コラボレーションを促進する機能が充実しているため、営業活動を効率的にサポートします。,3,2022-09-20 22:05,2023-06-26 11:48,NULL
XK1KMFN6Q1AL,7GJOXNES7Z,NULL,68785531,私たちの新しい金融サービスは、薬品業界向けに特化した資金調達ソリューションを提供します。時事ネタに基づいたマーケティング戦略で、サプライチェーンの効率を向上させるイノベーションを実現。これにより、業界の変化に迅速に対応できる体制を整えます。,6,2022-09-29 18:43,NULL,NULL
0LXXM953KRQI,M8SMLGUTSE,NULL,77131648,この商品は、製造業や医療、金融、流通、薬品分野でのプロジェクト管理を強化し、失敗事例を分析することでリスクを軽減します。フォローアップ機能により、リードの進捗を追跡し、効率的な営業活動をサポートします。信頼性の高いツールで、業界を問わず成果を上げることが期待できます。,6,2022-10-01 01:04,2023-05-07 11:13,NULL
N2AQX26A6JZ3,WK09AB9UNP,NULL,98263623,私たちの新商品は、流通の効率を大幅に向上させる技術を搭載しており、競合分析を通じて市場のニーズに応えています。最近のイベントでのデモでは、実際の失敗事例から学んだ改善点を活かし、交渉の際の説得力も高まっています。技術サポートも充実しており、導入後の安心感を提供します。,6,2022-10-01 08:59,NULL,NULL
48JNYUTVGPIH,90Q9VYRVSK,NULL,72415063,この教育・トレーニングプロジェクトは、営業チームのスキル向上に最適です。実践的なプレゼンテーション技術を学ぶことで、顧客との信頼関係を築きやすくなり、成約率の向上が期待できます。お客様のニーズに応じたアプローチが可能になるため、競争優位性を持つことができます。,0,2022-10-01 21:09,2023-12-10 07:12,NULL
MR2RF9ZKXNVX,7JBBIUF3QU,NULL,88977777,当社の新商品は、時事ネタとして注目されるサプライチェーンの課題を解決するために開発されました。効率的なコラボレーションを促進し、業界内での競争力を高めることができます。今すぐ導入して、ビジネスの成長を実現しましょう！,1,2022-10-04 18:47,NULL,NULL
3PR1QM7PH50R,OB1GSH8AML,NULL,33819417,当社の金融プレゼンテーションツールは、成功事例を豊富に取り入れており、イベントでのアピール力を格段に向上させます。さらに、技術サポートが充実しているため、導入後も安心してご利用いただけます。営業活動を強力にサポートするこの商品をぜひご検討ください。,0,2022-10-05 02:58,2023-08-21 11:57,NULL
3D8BFBIZ3VFD,CEDDHWC59U,NULL,93852109,新商品は、薬品業界における生産性向上を実現する画期的なソリューションです。プレゼンテーションやフォローアップを通じて、マーケティングイベントでの提案書を活用し、顧客のニーズに応じた効果的な営業戦略を展開できます。この商品は、業務効率を高めるだけでなく、顧客満足度の向上にも寄与します。,8,2022-10-06 02:45,NULL,NULL
I2C7Z9LMKVH2,BAZ0PHOGRC,NULL,94558255,この商品は介護現場でのコスト削減を実現するために特化したプロジェクト管理ツールです。技術サポートも充実しており、導入後のサポート体制が整っているため、安心して利用できます。効率的な運営を目指す方に最適な選択肢です。,10,2022-10-06 16:00,2022-12-22 10:48,NULL
VQSRBBQAR4D0,LYK5RZ5JJW,NULL,68785531,この商品は、薬品業界の最新の時事ネタを反映し、失敗事例を分析することで生産性向上に寄与します。営業の視点から見ると、競合との差別化が図れ、顧客の信頼を得やすい点が大きな魅力です。ぜひ導入を検討してみてください。,5,2022-10-06 23:23,NULL,NULL
QV71WF40SFZM,NU212I8EAW,NULL,27750243,当社の医療機器は、製造業のニーズに応える高い品質と信頼性を誇ります。最近のサプライチェーンの課題を克服するため、迅速な交渉と納品体制を整えています。時事ネタとしても注目されるこの商品は、医療現場での効率化に寄与すること間違いありません。,8,2022-10-09 12:27,NULL,NULL
ICNEKWDD8O8K,NZI17482TU,NULL,36393300,この商品は介護業界のトレンドを捉えた優れた選択肢です。競合分析を行った結果、顧客対応に優れた点が際立っており、交渉の際も柔軟な提案が可能です。営業においては、顧客ニーズに基づいたアプローチが成功の鍵となります。,4,2022-10-10 22:13,2024-06-20 02:35,NULL
OC64XORMDNEN,KJC0OZMC9P,NULL,50360736,この商品は、最新のトレンドを反映したイノベーションを取り入れた教育・トレーニングツールです。技術サポートも充実しており、顧客のニーズに応じた柔軟な対応が可能です。営業チームにとって、顧客への提案がしやすく、信頼性の高い商品です。,3,2022-10-14 14:02,2024-05-11 01:24,NULL
NLN0PMT4ECHY,GZ8D27ZLIC,NULL,42908251,新商品は、コスト削減を実現する革新的なサービスを提供します。プレゼンテーションも洗練されており、リード獲得に最適なツールです。営業活動を効率化し、顧客満足度を向上させることができるため、ぜひお試しください。,4,2022-10-14 21:32,2024-01-27 13:11,NULL
LQRX83CK5T67,NDGKNPTNLK,NULL,49780674,最新の医療トレンドを反映した当社の新商品は、失敗事例を踏まえた革新的なアプローチで開発されました。イベントでのデモンストレーションを通じて、その効果を実感できる機会を提供し、リード獲得につなげる提案書もご用意しています。ぜひご検討ください。,8,2022-10-17 11:34,NULL,NULL
8FCPGPFVXVZY,AFM30TRIXQ,NULL,04125772,当社の医療薬品は、プロジェクト管理の失敗事例を分析し、リードタイムを短縮することで生産性向上を実現しました。これにより、患者さんへの迅速な対応が可能となり、医療現場での信頼性が向上します。ぜひご検討ください。,3,2022-10-20 20:27,2024-06-21 00:18,NULL
HHW0R2LX9AKY,AV62989B5M,NULL,43979678,このITサービスは、最新のトレンドを取り入れた革新的なソリューションであり、生産性向上に寄与します。コラボレーション機能が強化されており、チーム全体のフォローアップを効率化し、営業活動をスムーズに進めることが可能です。,1,2022-10-21 23:40,2024-04-19 21:06,NULL
SK9LH3RIUA0N,NDGKNPTNLK,NULL,00975148,この薬品は、プレゼンテーションの際に顧客の関心を引くポイントが豊富で、交渉をスムーズに進めるための強力なツールです。顧客満足度も高く、実績が証明する信頼性があります。営業の現場での効果を実感できる商品です。,8,2022-10-24 12:05,2023-08-23 14:02,NULL
W86C1Q8UAVKI,2YNP7O7VVF,NULL,37112060,当社の最新商品は、ITと医療の融合を実現し、フォローアップを効率化します。法律・規制に準拠した技術サポートを提供し、品質管理も徹底。業界のニーズに応える信頼性の高いソリューションです。,16,2022-10-24 17:19,NULL,NULL
5D8V1O08JGJB,BVVGZYLMT1,NULL,16516339,この商品は、営業チームにとって非常に価値のあるツールです。プレゼンテーション機能により、効果的な提案が可能になり、部署間連携がスムーズに進むことでプロジェクトの進行が加速します。また、品質管理の要素が組み込まれているため、顧客満足度を高めることができる点も魅力です。,2,2022-10-26 23:35,2024-07-24 20:53,NULL
GY4V6QEN3XNT,P66C5GMFVZ,NULL,75830881,当社の新薬品は、厳格な法律・規制を遵守しつつ、高い品質管理を実現しています。既存商品と比較して生産性向上を図るための課題解決に特化しており、業界のニーズに応える革新的なサービスを提供します。ぜひお試しください！,10,2022-10-28 01:48,2023-12-31 18:58,NULL
L8FWEL22QXFU,H1GE9OEZHN,NULL,49780674,新商品は、顧客対応やフォローアップの面で非常に優れたパフォーマンスを発揮します。特に、教育・トレーニングを通じて顧客満足度を高めることができるため、イベントでのプレゼンテーションでも好評です。信頼性の高い薬品として、顧客からの評価も非常に高いです。,4,2022-10-29 10:31,2024-08-18 13:14,NULL
JAXUX5P2WN92,Q0WOPM4JJW,NULL,44113628,この商品は、金融業界に特化したプレゼンテーションツールであり、成功事例を活用したフォローアップ機能が充実しています。競合分析を通じて生産性向上を実現し、時事ネタを取り入れることで、クライアントへの提案力が格段にアップします。営業活動を効率化し、成果を最大化するための必須アイテムです。,3,2022-11-03 11:13,NULL,NULL
7E82XYQLCAIG,G033Q1QI0Z,NULL,33819417,最新の製造業向けトレンドを反映したこのタグ情報サービスは、効率的な在庫管理や生産プロセスの最適化に大いに役立ちます。営業視点から見ると、顧客のニーズに応じたデータ分析が可能で、競争力を高める強力なツールです。今すぐ導入して、業務の生産性を飛躍的に向上させましょう！,1,2022-11-04 07:10,2023-05-31 01:42,NULL
Z9CL5R255WW8,605S9NIHMN,NULL,43979678,当社の新しいITソリューションは、流通業界の課題解決に特化しており、法律・規制の遵守をサポートします。生産性向上を実現し、顧客ニーズに応じたプレゼンテーションが可能です。イベントでのデモも好評で、多くの企業から高い評価を得ています。,7,2022-11-09 06:52,2024-07-13 01:52,NULL
32X94KV88GGF,P8N7DNRO5Y,NULL,29372843,当社の新薬品は、流通の効率性を高め、教育・トレーニングプログラムを通じて顧客満足度を向上させることを目指しています。また、法律・規制に完全準拠しているため、安心してご利用いただけます。これにより、営業活動の信頼性が増し、顧客との関係構築が一層スムーズになります。,7,2022-11-14 04:42,2023-10-01 14:12,NULL
5JLTQZSXZMGW,BNJBT7LP9E,NULL,29372843,この商品は、最新のトレンドを反映したデザインと機能性を兼ね備えており、顧客対応も迅速で満足度が高いです。流通網が整備されているため、競合他社と比較しても優位性があります。成功事例として、あるコラボレーションを通じて市場シェアを拡大した実績もあり、営業活動において強力な武器となります。,4,2022-11-16 06:58,NULL,NULL
34VL3RFAWIIR,LPG19DRL6X,NULL,43979678,当社の商品は、競合分析を基に顧客ニーズに応える特長を持っています。最近のイベントでのフィードバックを反映し、使いやすさと機能性を強化しました。これにより、競争力のある価格で高い満足度を提供し、顧客の期待を超える製品となっています。,0,2022-11-20 21:25,2024-05-02 05:02,NULL
S7YLI2PZZREY,G4J90885G4,NULL,56361306,当社の新商品は、プロジェクト管理を効率化し、コスト削減を実現する優れた機能を備えています。高い品質管理基準をクリアしており、信頼性のある成果を提供します。これにより、顧客のビジネスを一層強化することができます。,6,2022-11-20 23:52,2024-01-07 04:37,NULL
JYOVBEY6807M,GGDTWZNYIC,NULL,53405714,当社の新商品は、顧客満足度を高めるために、法律・規制に準拠した品質管理を徹底しています。また、サプライチェーンの最適化を図り、交渉時の失敗事例を分析して提案書を改善しました。コラボレーションを通じて、より効果的な営業戦略を実現しています。,0,2022-11-21 01:27,NULL,NULL
F4EJO9Y7RZ53,3XGSL3ERPT,NULL,94558255,当社の介護向け商品は、プレゼンテーションやプロジェクト管理に特化した機能を備えており、マーケティング戦略の一環として課題解決をサポートします。サプライチェーンの効率化を図ることで、提案書作成もスムーズに行え、顧客への信頼感を高めることができます。,4,2022-11-22 14:06,NULL,NULL
M3A1XHRICB9A,949Z0H3KLR,NULL,53405714,この商品は、ITと医療、金融の融合を実現し、マーケティング戦略を強化します。顧客満足度を向上させるためのイノベーションを提供し、生産性を飛躍的に向上させることが可能です。営業チームにとって、必携のツールとなるでしょう。,6,2022-11-23 13:50,2024-03-06 16:25,NULL
I4K7NW6ZF5OS,P8N7DNRO5Y,NULL,77131648,当社の商品は、流通の効率性を追求し、競合分析を通じて市場での優位性を確立しています。品質管理の徹底により、顧客満足度を高め、フォローアップを行うことで長期的な関係構築を実現。交渉においても柔軟な対応が可能で、ニーズに合った提案を行います。,3,2022-11-25 16:46,2023-01-31 13:46,NULL
G3CIU2MX45Z8,SGI0Y3UI73,NULL,44113628,この商品は、イベントでの成功事例を基に開発されており、サプライチェーンの効率化を実現します。生産性向上に寄与する機能が満載で、営業活動の強力なサポートとなるでしょう。ぜひご検討ください！,5,2022-11-27 08:26,2023-11-25 01:23,2023-06-19 00:21
DZSU215QW929,7RM5SKJIBV,NULL,53405714,この金融商品は、顧客対応が非常に優れており、迅速かつ丁寧なサポートが魅力です。競合分析を行った結果、他社製品に比べて利便性が高く、顧客満足度も向上しています。ぜひ、営業活動に取り入れて、顧客に自信を持って提案したい一品です。,2,2022-11-30 11:23,2023-05-23 01:14,NULL
2P622TH89S45,HU1LUCYO06,NULL,00975148,当社の新商品は、顧客満足度を向上させるために設計されており、イベントでの使用にも最適です。品質管理が徹底されているため、安心してご利用いただけ、コスト削減にも貢献します。ぜひこの機会にお試しください！,3,2022-12-01 18:53,NULL,NULL
QHZLT66MNY0O,0B2JY2H068,NULL,04125772,この商品は、IT業界や製造業、金融、流通分野におけるプロジェクトの失敗事例を分析し、生産性向上に貢献します。営業チームが具体的なデータを基に提案できるため、顧客の信頼を得やすく、成約率の向上が期待できます。,3,2022-12-05 14:14,2024-06-11 06:16,NULL
O7BE8UQPZ0QH,95916MF0BS,NULL,78555463,この商品は、金融業界に特化した交渉スキルを磨くための優れたツールです。時事ネタを取り入れたマーケティング戦略により、クライアントとのクロージング率が向上します。営業の現場での実践に役立つ内容が満載です。,1,2022-12-12 08:41,2023-09-19 03:20,NULL
G6M1D3C9YPF4,SRN9S1XR4V,NULL,88922696,当社の新サービスは、顧客ニーズに応じたカスタマイズが可能で、法律・規制にも完全準拠しています。これにより、サプライチェーンの効率化を図り、コスト削減を実現します。提案書を通じて具体的なメリットを明示し、クライアントにとっての価値を最大化します。,2,2022-12-14 08:36,NULL,NULL
AXQ50XCE4AVB,4IC88G95NO,NULL,80989658,この商品は、営業チームにとっての強力なパートナーです。課題解決に特化した機能により、顧客のニーズに迅速に対応でき、技術サポートも充実しているため、安心して提案できます。また、コラボレーション機能が強化されているため、チーム全体での情報共有がスムーズに行え、営業活動の効率が大幅に向上します。,4,2022-12-16 11:30,2024-05-14 11:19,NULL
FOZMVLO9BBF2,S3U0MJB7KK,NULL,59233102,私たちの新しい薬品は、介護現場での課題解決に特化しており、生産性向上を実現します。使いやすさと効果の高さが評価されており、プロジェクトの成功をサポートします。ぜひ、導入をご検討ください。,3,2022-12-17 17:51,2023-04-08 05:04,NULL
C76UCKIM8CFW,S3U0MJB7KK,NULL,23248982,この商品は、流通業界に特化した営業支援ツールで、効率的な交渉をサポートします。教育・トレーニング機能も充実しており、新人営業マンのスキル向上に最適です。実践的なノウハウが詰まっており、売上向上に直結すること間違いなしです。,3,2022-12-17 20:28,2023-01-24 21:05,NULL
PUGOUL27R1ND,QB5VHY9IQR,NULL,98263623,新商品は、最新の技術を駆使し、生産性向上を実現する優れたソリューションです。時事ネタに基づいた提案書を用意し、具体的な導入効果を示すことで、クライアントのニーズに応える強力な営業ツールとなります。技術サポートも充実しており、安心して導入できる点が大きな魅力です。,3,2022-12-19 02:58,2024-07-04 04:33,NULL
LWU70WV4O208,OB1GSH8AML,NULL,36393300,この商品は、最新のトレンドを反映した優れたプレゼンテーションツールであり、交渉を成功に導くための強力なサポートを提供します。教育・トレーニングに最適で、技術サポートも充実しているため、営業チームのパフォーマンス向上に貢献します。成功事例も豊富で、導入後の効果を実感できるでしょう。,3,2022-12-19 10:42,2023-10-11 18:56,NULL
B1BWELCKNREI,TZHCJSEL0G,NULL,59233102,新商品として登場した介護用製品は、既存商品と比較して顧客満足度が向上しており、特に部署間連携がスムーズになった点が評価されています。失敗事例を踏まえたプレゼンテーションが効果的で、イベントでの実演が好評でした。この製品は製造業のニーズにも応え、業界全体の改善に寄与する可能性があります。,2,2022-12-20 15:03,NULL,2024-07-16 04:25
GY7FS6MTG750,605S9NIHMN,NULL,33648077,当社の新しい医療機器は、最新のトレンドを取り入れた設計で、現場の課題を的確に解決します。使いやすさと高い効果を兼ね備え、医療従事者の負担を軽減し、患者様の満足度向上に寄与します。ぜひこの機会にご検討ください。,2,2022-12-22 12:48,NULL,NULL
